{
  "$schema": "https://lumicorp.github.io/ruhroh/schemas/claim-index-v2.schema.json",
  "version": "ruhroh_claim_index_v2",
  "generatedAt": "2026-07-08T12:00:00.000Z",
  "source": {
    "inputPath": "./ruhroh-publication",
    "htmlPath": "./ruhroh-claims.html"
  },
  "registryReady": false,
  "registryBlockers": [
    "blocked claim ./ruhroh-publication: run plan warning: result sample adapter mismatch for simple-newsletter/agent-a/1-of-2: result=docs-fixture-native-stack plan=agent-a"
  ],
  "claimCount": 1,
  "publishableCount": 0,
  "blockedCount": 1,
  "invalidCount": 0,
  "suiteCount": 1,
  "targetCount": 1,
  "totalRuns": 2,
  "totalAcceptedOutcomes": 1,
  "claims": [
    {
      "claimPath": "./ruhroh-publication/benchmark-claim.json",
      "bundlePath": "./ruhroh-publication",
      "valid": true,
      "publishable": false,
      "scope": "suite",
      "createdAt": "2026-07-08T12:00:00.000Z",
      "suite": {
        "id": "ruhroh-sample",
        "title": "Ruhroh Sample Evidence Pack",
        "suiteVersion": "0.1.0"
      },
      "targets": [
        {
          "benchmarkTargetId": "docs-fixture-native-stack",
          "identityStatus": "declared",
          "executionAdapterIds": [
            "agent-a"
          ],
          "runs": 2,
          "acceptedOutcomes": 1,
          "qualityFloorStatus": "indeterminate",
          "paretoStatus": "indeterminate",
          "robustStatus": "indeterminate"
        }
      ],
      "summary": {
        "scenarioCount": 1,
        "targetCount": 1,
        "totalRuns": 2,
        "totalAcceptedOutcomes": 1,
        "runWeightedPassRate": 0.5,
        "runWeightedPassRateCi95": {
          "method": "wilson",
          "confidenceLevel": 0.95,
          "lower": 0.09453120573423071,
          "upper": 0.9054687942657693
        },
        "reviewRequired": 0,
        "reviewRecommended": 1,
        "pairwiseComparisonCount": 0
      },
      "frontier": {
        "status": "quality_only",
        "objectives": [],
        "paretoFrontierTargetIds": [],
        "robustFrontierTargetIds": []
      },
      "evidence": {
        "runPlanPresent": true,
        "runPlanWarnings": [
          "result sample adapter mismatch for simple-newsletter/agent-a/1-of-2: result=docs-fixture-native-stack plan=agent-a",
          "result sample adapter mismatch for simple-newsletter/agent-a/2-of-2: result=docs-fixture-native-stack plan=agent-a"
        ],
        "artifactValidationErrors": 0,
        "artifactValidationWarnings": 0,
        "artifactCompletenessWarnings": 0,
        "reviewQueueItems": 1,
        "requiredReviewItems": 0,
        "recommendedReviewItems": 1
      },
      "sourcePaths": {
        "resultsPath": "sources/results",
        "runPlanPath": "sources/ruhroh-run-plan.json",
        "suitePath": "sources/suite/suite.json"
      },
      "blockers": [
        "run plan warning: result sample adapter mismatch for simple-newsletter/agent-a/1-of-2: result=docs-fixture-native-stack plan=agent-a",
        "run plan warning: result sample adapter mismatch for simple-newsletter/agent-a/2-of-2: result=docs-fixture-native-stack plan=agent-a",
        "docs-fixture-native-stack: suite minimum runs or scenario coverage not satisfied",
        "simple-newsletter/docs-fixture-native-stack: fewer than 5 runs; treat pass rate and pass@k as directional",
        "simple-newsletter/docs-fixture-native-stack: missing effective budget hash metadata in aggregate group",
        "simple-newsletter/docs-fixture-native-stack: missing effective capabilities hash metadata in aggregate group",
        "simple-newsletter/docs-fixture-native-stack: eval-quality warnings present",
        "claim is not marked publishable"
      ],
      "advisories": [
        "docs-fixture-native-stack: simple-newsletter has 2/5 required runs",
        "docs-fixture-native-stack: scenario-level warnings present",
        "simple-newsletter/docs-fixture-native-stack: eval command evidence includes non-zero exit codes (1)",
        "simple-newsletter/docs-fixture-native-stack/sample-newsletter-agent-a-2: review recommended"
      ],
      "validationErrors": [],
      "validationWarnings": []
    }
  ]
}
